{"algorithm":"Ed25519","payload":{"domain":"pcs-certificate-signature-v2","format":"pcs-jcs-ed25519-payload-v1","payload":{"canonical_json_profile":"pcs-jcs-rfc8785-v1","checker_version":"pcs-python-kernel/0.6.0-ai-safety-golden","integrity_hash":"2b730066d3cadec7795c85571e8e47ff620c86b4f1b11d4ffe510fd7966edc56","integrity_hash_format":"pcs-certificate-integrity-sha256-v2","semantic_hash":"4bb872953a6be4880479ab16f64ce5f88cb3f99ce04a46e3d1a332d30c65a35a","semantic_hash_format":"pcs-certificate-semantic-sha256-v2","spec_version":"pcs-0.6","subject":"PCS AI-safety golden fixture"}},"payload_sha256":"2db3a7ee42039afaee392f00b39c6c622b2fe5a02985118d37c3fedb496f56f1","public_key_fingerprint":"21fe31dfa154a261626bf854046fd2271b7bed4b6abe45aa58877ef47f9721b9","signature":"q+oKMRjViy/dnSQOgHZeHhMXoajeem3lSS9Nrp8Km+IznyhxLmB1zPOFvFkeyI8EUVKKAnW+zoQPDCV8vOe6BA==","signature_format":"pcs-ed25519-jcs-v2"}